{
  "schema_version": "linkedin-client-report-v2-fixture-2",
  "fixture_id": "FIXTURE-JSC2-LEADERSHIP-STORY-GENERAL",
  "internal_candidate_id": "CANDIDATE-JSC2-SYNTH",
  "origin_class": "synthetic_from_authorized_structural_review",
  "derivation": "composite_plus_counterfactual_perturbation",
  "real_profile_mapping": "none_created",
  "locale": "en",
  "evaluation_date": "2026-08-07",
  "evidence_mode": "authorized_visual_visible",
  "structural_state_fixture": {"observations": [
    {"evidence_id": "EVID-JSC2-VISUAL", "section": "visual", "state": "visible"}, {"evidence_id": "EVID-JSC2-HEADLINE", "section": "headline", "state": "present"},
    {"evidence_id": "EVID-JSC2-ABOUT", "section": "about", "state": "present"}, {"evidence_id": "EVID-JSC2-EXPERIENCE", "section": "experience", "state": "present"},
    {"evidence_id": "EVID-JSC2-SKILLS", "section": "skills", "state": "present"}, {"evidence_id": "EVID-JSC2-PROOF", "section": "proof", "state": "not_inspected"},
    {"evidence_id": "EVID-JSC2-COMPLETE", "section": "completeness", "state": "present"}, {"evidence_id": "EVID-JSC2-PRIORITY-1", "section": "about", "state": "present"},
    {"evidence_id": "EVID-JSC2-PRIORITY-2", "section": "experience", "state": "present"}, {"evidence_id": "EVID-JSC2-PRIORITY-3", "section": "proof", "state": "not_inspected"}
  ]},
  "synthetic_fact_catalog": [
    {"fact_id": "FACT-JSC2-READY", "evidence_state": "verified", "fact_type": "role_signal", "role_family": "engineering_leadership", "capability_family": "leadership", "scope_bucket": "team", "claim_tokens": ["LEADERSHIP", "DELIVERY"]},
    {"fact_id": "FACT-JSC2-UNKNOWN", "evidence_state": "unknown", "fact_type": "scope_signal", "role_family": "engineering_leadership", "capability_family": "leadership", "scope_bucket": "unknown", "claim_tokens": ["OUTCOME_SCOPE"]}
  ],
  "score_ledger": {"numeric_weighted_total": 55.0, "scored_weight": 90, "not_scored_weight": 10, "overall_score": 61, "confidence": "high", "domains": [
    {"domain": "visual", "weight": 15, "state": "scored", "raw_score": 70, "weighted_points": 10.5, "evidence_ids": ["EVID-JSC2-VISUAL"], "reason_code": "VISUAL_VISIBLE"},
    {"domain": "headline", "weight": 15, "state": "scored", "raw_score": 55, "weighted_points": 8.25, "evidence_ids": ["EVID-JSC2-HEADLINE"], "reason_code": "CONTENT_GENERAL"},
    {"domain": "about", "weight": 15, "state": "scored", "raw_score": 55, "weighted_points": 8.25, "evidence_ids": ["EVID-JSC2-ABOUT"], "reason_code": "CONTENT_GENERAL"},
    {"domain": "experience", "weight": 20, "state": "scored", "raw_score": 60, "weighted_points": 12.0, "evidence_ids": ["EVID-JSC2-EXPERIENCE"], "reason_code": "CONTENT_GENERAL"},
    {"domain": "skills", "weight": 15, "state": "scored", "raw_score": 60, "weighted_points": 9.0, "evidence_ids": ["EVID-JSC2-SKILLS"], "reason_code": "CONTENT_SPECIFIC"},
    {"domain": "proof", "weight": 10, "state": "not_scored", "raw_score": null, "weighted_points": 0.0, "evidence_ids": ["EVID-JSC2-PROOF"], "reason_code": "PROOF_NOT_SCORED"},
    {"domain": "completeness", "weight": 10, "state": "scored", "raw_score": 70, "weighted_points": 7.0, "evidence_ids": ["EVID-JSC2-COMPLETE"], "reason_code": "STRUCTURAL_COMPLETE"}
  ]},
  "priorities": [
    {"priority_id": "PRIORITY-JSC2-1", "rank": 1, "section": "about", "diagnosed_gap": "GAP-B-PRIMARY", "action_type": "ACTION-B-ABOUT", "evidence_ids": ["EVID-JSC2-PRIORITY-1"], "timebox": "TIMEBOX-B-1", "done_when": "DONE-WHEN-B-1", "impact_basis": "COACH_HEURISTIC"},
    {"priority_id": "PRIORITY-JSC2-2", "rank": 2, "section": "experience", "diagnosed_gap": "GAP-B-SECONDARY", "action_type": "ACTION-B-EXPERIENCE", "evidence_ids": ["EVID-JSC2-PRIORITY-2"], "timebox": "TIMEBOX-B-2", "done_when": "DONE-WHEN-B-2", "impact_basis": "COACH_HEURISTIC"},
    {"priority_id": "PRIORITY-JSC2-3", "rank": 3, "section": "proof", "diagnosed_gap": "GAP-B-PROOF", "action_type": "ACTION-B-HEADLINE", "evidence_ids": ["EVID-JSC2-PRIORITY-3"], "timebox": "TIMEBOX-B-3", "done_when": "DONE-WHEN-B-3", "impact_basis": "COACH_HEURISTIC"}
  ],
  "copy_blocks": [
    {"copy_id": "COPY-JSC2-PRIMARY", "section": "about_opening", "state": "ready", "audience": "HIRING_MANAGER", "problem": "GENERAL_LEADERSHIP_STORY", "fact_ids": ["FACT-JSC2-READY"], "evidence_ids": ["EVID-JSC2-ABOUT"], "claim_boundary": "USE_ONLY_SUPPORTED_FACTS"},
    {"copy_id": "COPY-JSC2-HEADLINE", "section": "headline", "state": "requires_confirmation", "audience": "RECRUITER", "problem": "GENERAL_LEADERSHIP_STORY", "fact_ids": ["FACT-JSC2-UNKNOWN"], "evidence_ids": ["EVID-JSC2-HEADLINE"], "claim_boundary": "CONFIRM_SCOPE_BEFORE_USE"},
    {"copy_id": "COPY-JSC2-EXPERIENCE", "section": "experience_bullet", "state": "omit", "audience": "TECHNICAL_PEER", "problem": "MISSING_PROOF_BOUNDARY", "fact_ids": [], "evidence_ids": ["EVID-JSC2-EXPERIENCE"], "claim_boundary": "OMIT_UNSUPPORTED_OUTCOME"}
  ],
  "blocked_claims": ["LEADERSHIP_SCOPE_UNQUANTIFIED"],
  "source_catalog": [
    {"source_id": "SOURCE-JSC2-1", "source_category": "good_profile", "source_class": "official", "url": "https://www.linkedin.com/help/linkedin/answer/a554351", "publisher": "LinkedIn", "document_title": "Good profile guidance", "access_date": "2026-08-01", "reachability": "reachable", "scope": "PROFILE_GUIDANCE", "inference_limit": "NO_INDIVIDUAL_OUTCOME_INFERENCE", "fallback": "COACH_HEURISTIC"},
    {"source_id": "SOURCE-JSC2-2", "source_category": "profile_photo", "source_class": "official", "url": "https://www.linkedin.com/help/linkedin/answer/a541850", "publisher": "LinkedIn", "document_title": "Profile photo guidance", "access_date": "2026-08-01", "reachability": "reachable", "scope": "PROFILE_GUIDANCE", "inference_limit": "NO_INDIVIDUAL_OUTCOME_INFERENCE", "fallback": "COACH_HEURISTIC"},
    {"source_id": "SOURCE-JSC2-3", "source_category": "cover_image", "source_class": "official", "url": "https://www.linkedin.com/help/linkedin/answer/a1377087", "publisher": "LinkedIn", "document_title": "Cover image guidance", "access_date": "2026-08-01", "reachability": "reachable", "scope": "PROFILE_GUIDANCE", "inference_limit": "NO_INDIVIDUAL_OUTCOME_INFERENCE", "fallback": "COACH_HEURISTIC"},
    {"source_id": "SOURCE-JSC2-4", "source_category": "featured_section", "source_class": "official", "url": "https://www.linkedin.com/help/linkedin/answer/a552452", "publisher": "LinkedIn", "document_title": "Featured section guidance", "access_date": "2026-08-01", "reachability": "reachable", "scope": "PROFILE_GUIDANCE", "inference_limit": "NO_INDIVIDUAL_OUTCOME_INFERENCE", "fallback": "COACH_HEURISTIC"},
    {"source_id": "SOURCE-JSC2-5", "source_category": "skills", "source_class": "official", "url": "https://www.linkedin.com/help/linkedin/answer/a549047", "publisher": "LinkedIn", "document_title": "Skills guidance", "access_date": "2026-08-01", "reachability": "reachable", "scope": "PROFILE_GUIDANCE", "inference_limit": "NO_INDIVIDUAL_OUTCOME_INFERENCE", "fallback": "COACH_HEURISTIC"},
    {"source_id": "SOURCE-JSC2-6", "source_category": "job_match", "source_class": "official", "url": "https://www.linkedin.com/help/linkedin/answer/a8078207", "publisher": "LinkedIn", "document_title": "Job match guidance", "access_date": "2026-08-01", "reachability": "reachable", "scope": "PROFILE_GUIDANCE", "inference_limit": "NO_INDIVIDUAL_OUTCOME_INFERENCE", "fallback": "COACH_HEURISTIC"},
    {"source_id": "SOURCE-JSC2-7", "source_category": "ai_hiring_agents", "source_class": "official", "url": "https://www.linkedin.com/help/linkedin/answer/a7437598", "publisher": "LinkedIn", "document_title": "How LinkedIn uses AI Agents to connect job seekers and hirers", "access_date": "2026-08-01", "reachability": "reachable", "scope": "PROFILE_GUIDANCE", "inference_limit": "NO_INDIVIDUAL_OUTCOME_INFERENCE", "fallback": "COACH_HEURISTIC"},
    {"source_id": "SOURCE-JSC2-8", "source_category": "job_seeker_hirer_connection", "source_class": "official", "url": "https://www.linkedin.com/help/linkedin/answer/a7134286", "publisher": "LinkedIn", "document_title": "Job seeker and hirer connection guidance", "access_date": "2026-08-01", "reachability": "reachable", "scope": "PROFILE_GUIDANCE", "inference_limit": "NO_INDIVIDUAL_OUTCOME_INFERENCE", "fallback": "COACH_HEURISTIC"}
  ],
  "authorization_state": {"inspection": "authorized", "external_actions": "not_authorized", "action_state": "not_executed"},
  "eval_expectations": {"scenario_class": "leadership_story_general", "primary_gap": "GAP-B-PRIMARY", "primary_copy_category": "about_opening", "pending_evidence_policy": "ASK_ONLY_IF_DECISION_CHANGES"}
}
