{
  "schema_version": "linkedin-client-report-v2-fixture-2", "fixture_id": "FIXTURE-JSC4-PARTIAL-VISUAL-PHOTO", "internal_candidate_id": "CANDIDATE-JSC4-SYNTH",
  "origin_class": "synthetic_from_authorized_structural_review", "derivation": "composite_plus_counterfactual_perturbation", "real_profile_mapping": "none_created",
  "locale": "en", "evaluation_date": "2026-08-07", "evidence_mode": "partial_visual_photo_only",
  "structural_state_fixture": {"observations": [
    {"evidence_id": "EVID-JSC4-VISUAL", "section": "visual", "state": "partially_visible"}, {"evidence_id": "EVID-JSC4-PHOTO", "section": "photo", "state": "visible"},
    {"evidence_id": "EVID-JSC4-BANNER", "section": "banner", "state": "not_inspected"}, {"evidence_id": "EVID-JSC4-HEADLINE", "section": "headline", "state": "present"},
    {"evidence_id": "EVID-JSC4-ABOUT", "section": "about", "state": "present"}, {"evidence_id": "EVID-JSC4-EXPERIENCE", "section": "experience", "state": "present"},
    {"evidence_id": "EVID-JSC4-SKILLS", "section": "skills", "state": "present"}, {"evidence_id": "EVID-JSC4-PROOF", "section": "proof", "state": "not_inspected"},
    {"evidence_id": "EVID-JSC4-COMPLETE", "section": "completeness", "state": "present"}, {"evidence_id": "EVID-JSC4-PRIORITY-1", "section": "about", "state": "present"},
    {"evidence_id": "EVID-JSC4-PRIORITY-2", "section": "experience", "state": "present"}, {"evidence_id": "EVID-JSC4-PRIORITY-3", "section": "proof", "state": "not_inspected"}
  ]},
  "synthetic_fact_catalog": [
    {"fact_id": "FACT-JSC4-READY", "evidence_state": "verified", "fact_type": "capability_signal", "role_family": "platform_reliability", "capability_family": "delivery", "scope_bucket": "cross_functional", "claim_tokens": ["DELIVERY", "TECHNICAL_SCOPE"]},
    {"fact_id": "FACT-JSC4-UNKNOWN", "evidence_state": "unknown", "fact_type": "proof_signal", "role_family": "platform_reliability", "capability_family": "none", "scope_bucket": "unknown", "claim_tokens": ["OUTCOME_SCOPE"]}
  ],
  "score_ledger": {"numeric_weighted_total": 47.25, "scored_weight": 75, "not_scored_weight": 25, "overall_score": 63, "confidence": "medium", "domains": [
    {"domain": "visual", "weight": 15, "state": "not_scored", "raw_score": null, "weighted_points": 0.0, "evidence_ids": ["EVID-JSC4-VISUAL", "EVID-JSC4-PHOTO", "EVID-JSC4-BANNER"], "reason_code": "PARTIAL_VISUAL_NO_AGGREGATE"},
    {"domain": "headline", "weight": 15, "state": "scored", "raw_score": 60, "weighted_points": 9.0, "evidence_ids": ["EVID-JSC4-HEADLINE"], "reason_code": "CONTENT_SPECIFIC"},
    {"domain": "about", "weight": 15, "state": "scored", "raw_score": 60, "weighted_points": 9.0, "evidence_ids": ["EVID-JSC4-ABOUT"], "reason_code": "CONTENT_GENERAL"},
    {"domain": "experience", "weight": 20, "state": "scored", "raw_score": 65, "weighted_points": 13.0, "evidence_ids": ["EVID-JSC4-EXPERIENCE"], "reason_code": "CONTENT_SPECIFIC"},
    {"domain": "skills", "weight": 15, "state": "scored", "raw_score": 65, "weighted_points": 9.75, "evidence_ids": ["EVID-JSC4-SKILLS"], "reason_code": "CONTENT_SPECIFIC"},
    {"domain": "proof", "weight": 10, "state": "not_scored", "raw_score": null, "weighted_points": 0.0, "evidence_ids": ["EVID-JSC4-PROOF"], "reason_code": "PROOF_NOT_SCORED"},
    {"domain": "completeness", "weight": 10, "state": "scored", "raw_score": 65, "weighted_points": 6.5, "evidence_ids": ["EVID-JSC4-COMPLETE"], "reason_code": "STRUCTURAL_COMPLETE"}
  ]},
  "priorities": [
    {"priority_id": "PRIORITY-JSC4-1", "rank": 1, "section": "about", "diagnosed_gap": "GAP-D-PRIMARY", "action_type": "ACTION-D-ABOUT", "evidence_ids": ["EVID-JSC4-PRIORITY-1"], "timebox": "TIMEBOX-D-1", "done_when": "DONE-WHEN-D-1", "impact_basis": "COACH_HEURISTIC"},
    {"priority_id": "PRIORITY-JSC4-2", "rank": 2, "section": "experience", "diagnosed_gap": "GAP-D-SECONDARY", "action_type": "ACTION-D-EXPERIENCE", "evidence_ids": ["EVID-JSC4-PRIORITY-2"], "timebox": "TIMEBOX-D-2", "done_when": "DONE-WHEN-D-2", "impact_basis": "COACH_HEURISTIC"},
    {"priority_id": "PRIORITY-JSC4-3", "rank": 3, "section": "proof", "diagnosed_gap": "GAP-D-PROOF", "action_type": "ACTION-D-EVIDENCE", "evidence_ids": ["EVID-JSC4-PRIORITY-3"], "timebox": "TIMEBOX-D-3", "done_when": "DONE-WHEN-D-3", "impact_basis": "COACH_HEURISTIC"}
  ],
  "copy_blocks": [
    {"copy_id": "COPY-JSC4-PRIMARY", "section": "experience_bullet", "state": "ready", "audience": "TECHNICAL_PEER", "problem": "PARTIAL_VISUAL_CONTEXT", "fact_ids": ["FACT-JSC4-READY"], "evidence_ids": ["EVID-JSC4-EXPERIENCE"], "claim_boundary": "USE_ONLY_SUPPORTED_FACTS"},
    {"copy_id": "COPY-JSC4-HEADLINE", "section": "headline", "state": "ready", "audience": "RECRUITER", "problem": "PARTIAL_VISUAL_CONTEXT", "fact_ids": ["FACT-JSC4-READY"], "evidence_ids": ["EVID-JSC4-HEADLINE"], "claim_boundary": "USE_ONLY_SUPPORTED_FACTS"},
    {"copy_id": "COPY-JSC4-ABOUT", "section": "about_opening", "state": "requires_confirmation", "audience": "HIRING_MANAGER", "problem": "MISSING_PROOF_BOUNDARY", "fact_ids": ["FACT-JSC4-UNKNOWN"], "evidence_ids": ["EVID-JSC4-ABOUT"], "claim_boundary": "CONFIRM_SCOPE_BEFORE_USE"}
  ],
  "blocked_claims": ["VISUAL_PARTIAL_NO_AGGREGATE"],
  "source_catalog": [
    {"source_id": "SOURCE-JSC4-1", "source_category": "good_profile", "source_class": "official", "url": "https://www.linkedin.com/help/linkedin/answer/a554351", "publisher": "LinkedIn", "document_title": "Good profile guidance", "access_date": "2026-08-01", "reachability": "reachable", "scope": "PROFILE_GUIDANCE", "inference_limit": "NO_INDIVIDUAL_OUTCOME_INFERENCE", "fallback": "COACH_HEURISTIC"},
    {"source_id": "SOURCE-JSC4-2", "source_category": "profile_photo", "source_class": "official", "url": "https://www.linkedin.com/help/linkedin/answer/a541850", "publisher": "LinkedIn", "document_title": "Profile photo guidance", "access_date": "2026-08-01", "reachability": "reachable", "scope": "PROFILE_GUIDANCE", "inference_limit": "NO_INDIVIDUAL_OUTCOME_INFERENCE", "fallback": "COACH_HEURISTIC"},
    {"source_id": "SOURCE-JSC4-3", "source_category": "cover_image", "source_class": "official", "url": "https://www.linkedin.com/help/linkedin/answer/a1377087", "publisher": "LinkedIn", "document_title": "Cover image guidance", "access_date": "2026-08-01", "reachability": "reachable", "scope": "PROFILE_GUIDANCE", "inference_limit": "NO_INDIVIDUAL_OUTCOME_INFERENCE", "fallback": "COACH_HEURISTIC"},
    {"source_id": "SOURCE-JSC4-4", "source_category": "featured_section", "source_class": "official", "url": "https://www.linkedin.com/help/linkedin/answer/a552452", "publisher": "LinkedIn", "document_title": "Featured section guidance", "access_date": "2026-08-01", "reachability": "reachable", "scope": "PROFILE_GUIDANCE", "inference_limit": "NO_INDIVIDUAL_OUTCOME_INFERENCE", "fallback": "COACH_HEURISTIC"},
    {"source_id": "SOURCE-JSC4-5", "source_category": "skills", "source_class": "official", "url": "https://www.linkedin.com/help/linkedin/answer/a549047", "publisher": "LinkedIn", "document_title": "Skills guidance", "access_date": "2026-08-01", "reachability": "reachable", "scope": "PROFILE_GUIDANCE", "inference_limit": "NO_INDIVIDUAL_OUTCOME_INFERENCE", "fallback": "COACH_HEURISTIC"},
    {"source_id": "SOURCE-JSC4-6", "source_category": "job_match", "source_class": "official", "url": "https://www.linkedin.com/help/linkedin/answer/a8078207", "publisher": "LinkedIn", "document_title": "Job match guidance", "access_date": "2026-08-01", "reachability": "reachable", "scope": "PROFILE_GUIDANCE", "inference_limit": "NO_INDIVIDUAL_OUTCOME_INFERENCE", "fallback": "COACH_HEURISTIC"},
    {"source_id": "SOURCE-JSC4-7", "source_category": "ai_hiring_agents", "source_class": "official", "url": "https://www.linkedin.com/help/linkedin/answer/a7437598", "publisher": "LinkedIn", "document_title": "How LinkedIn uses AI Agents to connect job seekers and hirers", "access_date": "2026-08-01", "reachability": "reachable", "scope": "PROFILE_GUIDANCE", "inference_limit": "NO_INDIVIDUAL_OUTCOME_INFERENCE", "fallback": "COACH_HEURISTIC"},
    {"source_id": "SOURCE-JSC4-8", "source_category": "job_seeker_hirer_connection", "source_class": "official", "url": "https://www.linkedin.com/help/linkedin/answer/a7134286", "publisher": "LinkedIn", "document_title": "Job seeker and hirer connection guidance", "access_date": "2026-08-01", "reachability": "reachable", "scope": "PROFILE_GUIDANCE", "inference_limit": "NO_INDIVIDUAL_OUTCOME_INFERENCE", "fallback": "COACH_HEURISTIC"}
  ],
  "authorization_state": {"inspection": "authorized", "external_actions": "not_authorized", "action_state": "not_executed"},
  "eval_expectations": {"scenario_class": "partial_visual_no_aggregate", "primary_gap": "GAP-D-PRIMARY", "primary_copy_category": "experience_bullet", "pending_evidence_policy": "ASK_ONLY_IF_DECISION_CHANGES"}
}
